No	Time		Source		Destination	Protocol	Info
792	11.571230303	192.168.45.145	128.119.245.12	HTTP	575	GET /wireshark-labs/HTTP-wireshark-file3.html HTTP/1.1 
1222	14.602813363	128.119.245.12	192.168.45.145	HTTP	1009	HTTP/1.1 200 OK  (text/html)

No	Time		Source		Destination	Info															Protocol			Length
4615	739.390744904	192.168.45.145	128.119.245.12	55940 → 80 [SYN] Seq=0 Win=64240 Len=0 MSS=1460 SACK_PERM=1 TSval=419006845 TSecr=0 WS=128				TCP				74
4617	739.872686050	128.119.245.12	192.168.45.145	80 → 55940 [SYN, ACK] Seq=0 Ack=1 Win=28960 Len=0 MSS=1318 SACK_PERM=1 TSval=707192749 TSecr=419006845 WS=128	TCP				74
4618	739.872811518	192.168.45.145	128.119.245.12	55940 → 80 [ACK] Seq=1 Ack=1 Win=64256 Len=0 TSval=419007327 TSecr=707192749					TCP				66
16574	1726.290292007	128.119.245.12	192.168.45.145	80 → 55940 [FIN, ACK] Seq=5346 Ack=913 Win=31104 Len=0 TSval=708178500 TSecr=419988420				TCP				66
